{
  "schema_version": 2,
  "student_name": "Student",
  "level": "L4",
  "level_label": "Cấp 4",
  "topic": "RAINBOW RIYA",
  "slug": "book_145681",
  "audio_filename": "book_145681.mp3",
  "book_slug": "book_145681",
  "book_images": [
    "https://audio.felixbuilderhub.com/books/book_145681/page_02.jpg",
    "https://audio.felixbuilderhub.com/books/book_145681/page_03.jpg",
    "https://audio.felixbuilderhub.com/books/book_145681/page_04.jpg",
    "https://audio.felixbuilderhub.com/books/book_145681/page_05.jpg",
    "https://audio.felixbuilderhub.com/books/book_145681/page_06.jpg",
    "https://audio.felixbuilderhub.com/books/book_145681/page_07.jpg"
  ],
  "book_page_audio": [
    "https://audio.felixbuilderhub.com/books/book_145681/page_02.mp3",
    "https://audio.felixbuilderhub.com/books/book_145681/page_03.mp3",
    "https://audio.felixbuilderhub.com/books/book_145681/page_04.mp3",
    "https://audio.felixbuilderhub.com/books/book_145681/page_05.mp3",
    "https://audio.felixbuilderhub.com/books/book_145681/page_06.mp3",
    "https://audio.felixbuilderhub.com/books/book_145681/page_07.mp3"
  ],
  "book_attribution": {
    "title": "RAINBOW RIYA",
    "creators": [
      "Udiksha Batra",
      "Helga Parekh",
      "Kanak Shashi",
      "Kavya Bagga",
      "Manjari Chakravarti",
      "Nikita Modi",
      "Rajiv Eipe",
      "Ruchi Bakshi"
    ],
    "publisher": "StoryWeaver Community",
    "credit_text": "This book was made possible by Pratham Books' StoryWeaver platform. Content under Creative Commons licenses can be downloaded, translated and can even be used to create new stories provided you give appropriate credit, and indicate if changes were made. To know more about this, and the full terms of use and attribution, please visit the following link . Story Attribution: This story: RAINBOW RIYA is written by Udiksha Batra . © Udiksha Batra , 2020. Some rights reserved. Released under CC BY 4.0 license. Images Attributions: Cover page: Girl and rainbow , by Helga Parekh © Pratham Books, 2011. Some rights reserved. Released under CC BY 4.0 license. Page 2: Nature Trail in a City , by Rajiv Eipe © StoryWeaver Team, 2017. Some rights reserved. Released under CC BY 4.0 license. Page 3: A person in the center of a rainbow , by Kanak Shashi © Pratham Books, 2019. Some rights reserved. Released under CC BY 4.0 license. Page 4: A sad girl sitting by the window , by Kavya Bagga © Pratham Books, 2013. Some rights reserved. Released under CC BY 4.0 license. Page 5: A girl in the dark , by Ruchi Bakshi © Pratham Books, 2019. Some rights reserved. Released under CC BY 4.0 license. Page 6: Girl playing with butterflies, rainbow and water , by Nikita Modi © StoryWeaver Team, 2016. Some rights reserved. Released under CC BY 4.0 license. Page 7: Girl under a rainbow , by Manjari Chakravarti © StoryWeaver Team, 2015. Some rights reserved. Released under CC BY 4.0 license. Disclaimer: https://www.storyweaver.org.in/terms_and_conditions Some rights reserved. This book is CC-BY-4.0 licensed. You can copy, modify, distribute and perform the work, even for commercial purposes, all without asking permission. For full terms of use and attribution, http://creativecommons.org/licenses/by/4.0/",
    "source_url": "https://storyweaver.org.in/stories/145681-rainbow-riya",
    "image_credits": [
      {
        "page_index": 0,
        "credit_text": "Nature Trail in a City , by Rajiv Eipe © StoryWeaver Team, 2017. Some rights reserved. Released under CC BY 4.0 license."
      },
      {
        "page_index": 1,
        "credit_text": "A person in the center of a rainbow , by Kanak Shashi © Pratham Books, 2019. Some rights reserved. Released under CC BY 4.0 license."
      },
      {
        "page_index": 2,
        "credit_text": "A sad girl sitting by the window , by Kavya Bagga © Pratham Books, 2013. Some rights reserved. Released under CC BY 4.0 license."
      },
      {
        "page_index": 3,
        "credit_text": "A girl in the dark , by Ruchi Bakshi © Pratham Books, 2019. Some rights reserved. Released under CC BY 4.0 license."
      },
      {
        "page_index": 4,
        "credit_text": "Girl playing with butterflies, rainbow and water , by Nikita Modi © StoryWeaver Team, 2016. Some rights reserved. Released under CC BY 4.0 license."
      },
      {
        "page_index": 5,
        "credit_text": "Girl under a rainbow , by Manjari Chakravarti © StoryWeaver Team, 2015. Some rights reserved. Released under CC BY 4.0 license."
      }
    ],
    "license": {
      "name": "CC BY 4.0",
      "url": "https://creativecommons.org/licenses/by/4.0/"
    }
  },
  "story": {
    "title": "RAINBOW RIYA",
    "paragraphs_en": [
      "There once lived a little girl name Riya who was 12 years old. She was a very special and unique little girl. She had the most beautiful 'greeny-grey' eyes and the sweetest smile. Riya also had the kindest heart. She could never bear to see any person or animal in pain, and would always try to help them out. She loved nature and always made sure she took good care of the environment by growing plants and avoiding littering. BUT DO YOU KNOW WHAT MADE HER SO VERY SPECIAL?",
      "She saw the world in rainbow colours, not the boring colours we see! When she wanted to, with her mind, she could also sprinkle glitter on ANYTHING and make it sparkle! Sadly, Riya did not feel that this was such an amazing gift. In fact, she felt ashamed of her talent and wished that she could see the world as everyone else did. This had not always been the case. When she was younger and out in the garden, delighting in the smell of roses and playing with her animal friends she had really enjoyed her rainbow sight with splotches of glitter. However, as soon as she started going to school, things changed. WHY DO YOU THINK THAT WAS?",
      "She would often get scolded by her teachers for not focusing on her lessons or not reading off the board properly, while her classmates would laugh at her and tease her. When she tried telling them that she couldn't see the writing properly due to the bright pretty colours and the splotches of glitter floating everywhere, or that often she would get distracted by how beautiful her friends' rainbow coloured faces and dresses would look, nobody believed her. SO SHE HAD STOPPED TRYING TO EXPLAIN.",
      "One night, a terrible storm struck her town and brought it to its knees. All the generators and power backups had all got fused and everything was in complete darkness. All the children felt scared and sat huddled in corners, while adults ran around trying to find torches and candles. The next day loomed dark and grey. And the day after, and the day after that! It was almost as if someone had 'put-out' the sun on purpose. Everyone was getting really worried now. The town had turned quiet and eerie, like a ghost town. However, they kept hearing laughter and giggles coming from Riya's house. \"WHATEVER IS GOING ON?\", THEY ASKED EACH OTHER.",
      "The next evening, her friends and even some of her school teachers went across to her house to see what was going on. When they entered her house, it was like a magical wonderland. The house shone bright with splashes of rainbow colours and blobs of glitter in between. It was the most beautiful sight they had ever seen. Riya was delighted that now it was not just she who could see the beautiful colours. When Riya moved, the colours seemed to move with her. They all rushed over to Riya and hugged her. \"COULD YOU PLEASE HELP US GET RID OF THIS DARK?\" THEY ASKED HER.",
      "So Riya went from house to house, shop to shop, restaurant to restaurant and school to school, bringing brightness and spreading rainbow colours and glitter wherever she went. People lined up on the roads to cheer her on and clap for her for bringing back colour, light and joy into their lives. FROM THAT DAY ON RIYA NEVER HAD TO HIDE HER SPECIAL GIFT AGAIN. SHE BECAME THE HAPPIEST LITTLE 12 YEAR OLD IN ALL THE LAND!"
    ],
    "sentences": [
      {
        "text_en": "There once lived a little girl name Riya who was 12 years old.",
        "paragraph_index": 0,
        "audio_url": "https://audio.felixbuilderhub.com/books/book_145681/s_000.mp3",
        "text_vi": "Ngày xửa ngày xưa, có một cô bé tên Riya, 12 tuổi."
      },
      {
        "text_en": "She was a very special and unique little girl.",
        "paragraph_index": 0,
        "audio_url": "https://audio.felixbuilderhub.com/books/book_145681/s_001.mp3",
        "text_vi": "Cô bé là một người rất đặc biệt và độc đáo."
      },
      {
        "text_en": "She had the most beautiful 'greeny-grey' eyes and the sweetest smile.",
        "paragraph_index": 0,
        "audio_url": "https://audio.felixbuilderhub.com/books/book_145681/s_002.mp3",
        "text_vi": "Cô bé có đôi mắt màu 'xám xanh' đẹp nhất và nụ cười ngọt ngào nhất."
      },
      {
        "text_en": "Riya also had the kindest heart.",
        "paragraph_index": 0,
        "audio_url": "https://audio.felixbuilderhub.com/books/book_145681/s_003.mp3",
        "text_vi": "Riya còn có một trái tim nhân hậu nhất."
      },
      {
        "text_en": "She could never bear to see any person or animal in pain, and would always try to help them out.",
        "paragraph_index": 0,
        "audio_url": "https://audio.felixbuilderhub.com/books/book_145681/s_004.mp3",
        "text_vi": "Cô bé không bao giờ chịu được khi thấy bất kỳ ai hay con vật nào đau đớn, và luôn cố gắng giúp đỡ họ."
      },
      {
        "text_en": "She loved nature and always made sure she took good care of the environment by growing plants and avoiding littering.",
        "paragraph_index": 0,
        "audio_url": "https://audio.felixbuilderhub.com/books/book_145681/s_005.mp3",
        "text_vi": "Cô bé yêu thiên nhiên và luôn đảm bảo chăm sóc tốt môi trường bằng cách trồng cây và không xả rác."
      },
      {
        "text_en": "BUT DO YOU KNOW WHAT MADE HER SO VERY SPECIAL?",